<?xml version="1.0" encoding="UTF-8"?><!--  ~ Copyright 2014, The Sporting Exchange Limited  ~  ~ Licensed under the Apache License, Version 2.0 (the "License");  ~ you may not use this file except in compliance with the License.  ~ You may obtain a copy of the License at  ~  ~     http://www.apache.org/licenses/LICENSE-2.0  ~  ~ Unless required by applicable law or agreed to in writing, software  ~ distributed under the License is distributed on an "AS IS" BASIS,  ~ WITHOUT WARRANTIES OR CONDITIONS OF ANY KIND, either express or implied.  ~ See the License for the specific language governing permissions and  ~ limitations under the License.  --><!-- Interface Version 4.0 --><xs:schema xmlns:xs="http://www.w3.org/2001/XMLSchema">	<xs:include schemaLocation="common.xsd"/>	<xs:include schemaLocation="exceptionType.xsd"/>	<xs:include schemaLocation="dataType.xsd"/>	<xs:include schemaLocation="eventType.xsd"/>	<xs:element name="interface" type="interface-type" nillable="false"/>	<xs:complexType name="interface-type">		<xs:sequence>			<xs:element name="authors" type="authors-type" minOccurs="0"/>			<xs:element name="description" type="description-type" minOccurs="0"/>			<xs:element name="operation" type="operation-type" minOccurs="0" maxOccurs="unbounded"/>			<xs:element name="event" type="event-type" minOccurs="0" maxOccurs="unbounded"/>			<xs:element name="dataType" type="dataType-type" minOccurs="0" maxOccurs="unbounded"/>			<xs:element name="exceptionType" type="exceptionType-type" minOccurs="0" maxOccurs="unbounded"/>			<xs:element name="extensions" type="extension-type" minOccurs="0"/>			<xs:element name="simpleType" type="base-parameter-type" minOccurs="0" maxOccurs="unbounded"/>			<xs:element name="sharedTypes" type="sharedTypes-type" minOccurs="0" maxOccurs="unbounded"/>		</xs:sequence>		<xs:attribute name="name" type="xs:string" use="required"/>		<xs:attribute name="owner" type="xs:string" use="optional"/>		<xs:attribute name="version" type="version-type" use="required"/>		<xs:attribute name="date" type="xs:string" use="optional"/>		<xs:attribute name="namespace" type="xs:string" use="optional"/>	</xs:complexType>	<xs:complexType name="operation-type">		<xs:sequence>			<xs:element name="description" type="description-type" minOccurs="0"/>			<xs:element name="parameters" type="parameters-type" minOccurs="0"/>			<xs:element name="consumers" type="consumers-type" minOccurs="0"/>			<xs:element name="extensions" type="extension-type" minOccurs="0"/>		</xs:sequence>		<xs:attribute name="name" type="xs:string"/>		<xs:attribute name="since" type="version-type"/>		<xs:attribute name="connected" type="xs:boolean" default="false" use="optional"/>	</xs:complexType>	<xs:complexType name="parameters-type">		<xs:sequence>			<xs:element name="request" type="request-type" minOccurs="0"/>			<xs:element name="simpleResponse" type="response-type" minOccurs="0"/>			<xs:element name="response" type="response-type" minOccurs="0"/>			<xs:element name="exceptions" type="exceptions-type" minOccurs="0"/>		</xs:sequence>	</xs:complexType>	<xs:complexType name="request-type">		<xs:sequence>			<xs:element name="parameter" type="extensible-parameter-type" minOccurs="0" maxOccurs="unbounded"/>		</xs:sequence>	</xs:complexType>	<xs:complexType name="response-type">		<xs:sequence>			<xs:element name="description" type="description-type" minOccurs="0"/>            <xs:element name="validValues" type="validValues-type" minOccurs="0"/>		</xs:sequence>		<xs:attribute name="type" type="xs:string" use="required"/>		<xs:attribute name="mandatory" type="xs:boolean" use="optional"/>	</xs:complexType>	<xs:complexType name="consumers-type">		<xs:sequence>			<xs:element name="product" type="product-type" maxOccurs="unbounded"/>		</xs:sequence>	</xs:complexType>	<xs:complexType name="product-type">		<xs:simpleContent>			<xs:extension base="xs:string">				<xs:attribute name="name" type="xs:string" use="required"/>			</xs:extension>		</xs:simpleContent>	</xs:complexType>	<xs:complexType name="authors-type">		<xs:sequence>			<xs:element name="author" type="author-type" maxOccurs="unbounded"/>		</xs:sequence>	</xs:complexType>	<xs:complexType name="author-type">		<xs:attribute name="name" type="xs:string"/>		<xs:attribute name="email" type="xs:string"/>	</xs:complexType></xs:schema>
